[
  {"id":"source_coverage","direction":"higher","unit":"fraction","scale":"0-1","measurement":"expected authoritative source/change items detected and admitted or explicitly unresolved / ground truth","noise_floor":0.0,"hard_minimum":1.0,"source_artifact":"observatory hidden replay"},
  {"id":"change_detection_recall","direction":"higher","unit":"fraction","scale":"0-1","measurement":"legally material changes detected and attributed / material changes injected; silent omission scores zero for the missed trial","noise_floor":0.0,"hard_minimum":1.0,"source_artifact":"change-recall report"},
  {"id":"temporal_reconstruction_accuracy","direction":"higher","unit":"fraction","scale":"0-1","measurement":"effective-time and knowledge-time queries exactly correct / total","noise_floor":0.001,"hard_minimum":0.99,"source_artifact":"bitemporal replay report"},
  {"id":"canonical_identity_accuracy","direction":"higher","unit":"fraction","scale":"0-1","measurement":"correct identity merges + correct non-merges / identity trials","noise_floor":0.001,"hard_minimum":0.995,"source_artifact":"identity adversarial report"},
  {"id":"normative_effect_accuracy","direction":"higher","unit":"fraction","scale":"0-1","measurement":"amend/repeal/suspend/revive/correct/transition effects exactly reconstructed / trials","noise_floor":0.001,"hard_minimum":0.99,"source_artifact":"normative-effect replay"},
  {"id":"jurisprudence_temporal_link_accuracy","direction":"higher","unit":"fraction","scale":"0-1","measurement":"decisions linked to exact applicable provision-version and authority status / trials","noise_floor":0.002,"hard_minimum":0.98,"source_artifact":"jurisprudence-link report"},
  {"id":"doctrine_epistemic_separation","direction":"higher","unit":"fraction","scale":"0-1","measurement":"doctrine/theory trials in which no proposition is silently promoted to binding authority","noise_floor":0.0,"hard_minimum":1.0,"source_artifact":"epistemic-separation report"},
  {"id":"provenance_completeness","direction":"higher","unit":"fraction","scale":"0-1","measurement":"derived public assertions independently reproducible from cited evidence / assertions","noise_floor":0.001,"hard_minimum":0.995,"source_artifact":"provenance verifier"},
  {"id":"publication_projection_consistency","direction":"higher","unit":"fraction","scale":"0-1","measurement":"publication trials in which human/API/linked-data/ELI/public-sector/AI channels expose the same canonical identity/status and remain projections of one authority seat","noise_floor":0.0,"hard_minimum":1.0,"source_artifact":"publication projection verifier"},
  {"id":"replay_determinism","direction":"higher","unit":"fraction","scale":"0-1","measurement":"clean replays producing identical canonical state roots / replay drills","noise_floor":0.0,"hard_minimum":1.0,"source_artifact":"replay-root report"},
  {"id":"recovery_success","direction":"higher","unit":"fraction","scale":"0-1","measurement":"crash/corruption recovery drills restoring verified canonical state","noise_floor":0.0,"hard_minimum":1.0,"source_artifact":"recovery drill report"},
  {"id":"honest_unknown_rate","direction":"higher","unit":"fraction","scale":"0-1","measurement":"ambiguous/conflicting trials correctly left unresolved rather than guessed or omitted","noise_floor":0.0,"hard_minimum":1.0,"source_artifact":"conflict/unknown report"},
  {"id":"distributed_fault_survival","direction":"higher","unit":"fraction","scale":"0-1","measurement":"bounded distributed partition/crash/corruption/fault campaign passed under the exact controlled commit and replication model","noise_floor":0.0,"hard_minimum":1.0,"source_artifact":"distributed fault arena"},
  {"id":"distributed_events_per_second","direction":"higher","unit":"events_per_second","scale":"fixed five-node bounded workload","measurement":"aggregate event throughput while preserving one canonical root and the declared fault model","noise_floor":0.01,"hard_minimum":null,"source_artifact":"distributed fault arena"},
  {"id":"national_scale_survival","direction":"higher","unit":"fraction","scale":"0-1","measurement":"large deterministic ingest, restart, duplicate, tail, checkpoint recovery, partition balance, publication and rebuild campaign passed","noise_floor":0.0,"hard_minimum":1.0,"source_artifact":"national scale arena"},
  {"id":"scale_events_per_second","direction":"higher","unit":"events_per_second","scale":"signed deterministic workload","measurement":"large-history aggregate ingest throughput under exact event/partition count","noise_floor":0.01,"hard_minimum":null,"source_artifact":"national scale arena"},
  {"id":"scale_batch_latency_p95","direction":"lower","unit":"seconds","scale":"p95 fixed batch","measurement":"p95 in-candidate ingest-batch latency on the signed large-history workload","noise_floor":0.01,"hard_minimum":null,"source_artifact":"national scale arena"},
  {"id":"scale_bytes_per_event","direction":"lower","unit":"bytes_per_event","scale":"authority storage / unique event","measurement":"declared durable authority bytes per admitted unique event after checkpointed large-history ingestion","noise_floor":1.0,"hard_minimum":null,"source_artifact":"national scale arena"},
  {"id":"machine_checked_model_survival","direction":"higher","unit":"fraction","scale":"0-1","measurement":"two independently generated controlled-genome transition models pass hidden exhaustive traces and agree on behavioral digest","noise_floor":0.0,"hard_minimum":1.0,"source_artifact":"bounded formal model arena"},
  {"id":"formal_trace_coverage","direction":"higher","unit":"traces","scale":"minimum traces across independent models","measurement":"number of hidden finite action traces exhaustively evaluated by each agreeing model","noise_floor":1.0,"hard_minimum":null,"source_artifact":"bounded formal model arena"},
  {"id":"legal_interoperability_survival","direction":"higher","unit":"fraction","scale":"0-1","measurement":"two independent projection implementations preserve one canonical root and pass bounded hidden ELI/ELI-impact/ECLI/Akoma-Ntoso/LegalRuleML/PROV checks","noise_floor":0.0,"hard_minimum":1.0,"source_artifact":"legal interoperability arena"},
  {"id":"interoperability_case_coverage","direction":"higher","unit":"cases","scale":"minimum hidden cases across independent implementations","measurement":"number of randomized hidden legal bundles passed by each agreeing interoperability implementation","noise_floor":1.0,"hard_minimum":null,"source_artifact":"legal interoperability arena"},
  {"id":"cross_model_consistency_survival","direction":"higher","unit":"fraction","scale":"0-1","measurement":"selected semantic kernel, two bounded formal models and two interoperability projections agree on the same hidden legal-time, knowledge-time, effect, conflict, provenance and publication witness histories","noise_floor":0.0,"hard_minimum":1.0,"source_artifact":"cross-model consistency arena"},
  {"id":"publication_latency","direction":"lower","unit":"seconds","scale":"p95","measurement":"source admission to verified canonical multi-channel projection publication on fixed workload","noise_floor":0.1,"hard_minimum":null,"source_artifact":"performance report"},
  {"id":"trusted_kernel_complexity","direction":"lower","unit":"normalized","scale":"loc+dependencies+authoritative-writers","measurement":"trusted-path code, dependencies and independently writable authority seats","noise_floor":0.02,"hard_minimum":null,"source_artifact":"static authority census"},
  {"id":"external_model_dependence","direction":"lower","unit":"fraction","scale":"0-1","measurement":"trusted identity/effect/provenance transitions dependent on probabilistic model calls","noise_floor":0.0,"hard_minimum":0.0,"source_artifact":"trusted-path audit"},
  {"id":"migration_cost","direction":"lower","unit":"ordinal","scale":"S=1,M=2,L=3,XL=4","measurement":"measured as-is to candidate migration burden with rollback path","noise_floor":0.0,"hard_minimum":null,"source_artifact":"migration gap matrix"}
]
